<?xml version="1.0"?>
<!DOCTYPE texinfo PUBLIC "-//GNU//DTD TexinfoML V4.12//EN" "http://www.gnu.org/software/texinfo/dtd/4.12/texinfo.dtd">
<texinfo xml:lang="en">

<setfilename>direntry_dircategory.xml</setfilename>

<dircategory>&ldquo;category&mdash;<var>th  ere</var>?&rdquo;</dircategory>
<direntry>
<menuentry>
<menunode>(foo)</menunode>
<menutitle> foo</menutitle>
<menucomment>   &ldquo;hello&mdash;<var>there</var>?&rdquo;
</menucomment>
</menuentry></direntry>

<dircategory>cat2</dircategory>
<direntry>
<menuentry>
<menunode>aaa</menunode>
<menutitle>aaa </menutitle>
<menucomment>               aaaa
                   bbbbb
</menucomment>
</menuentry>
<para>menutitle
</para></direntry>


<node>
<nodename>Top</nodename>
<nodenext>chapter</nodenext>
<nodeup>(dir)</nodeup>
</node>
<top>
<title>Test dircategory and direntry</title>

<para>Text
<dircategory>in text</dircategory>
</para><direntry>
<menuentry>
<menunode>(in_text)</menunode>
<menutitle> in text</menutitle>
<menucomment> in text
</menucomment>
</menuentry></direntry>

<menu>
<menuentry>
<menunode>chapter</menunode>
<menutitle>chapter</menutitle>
<menucomment>
</menucomment>
</menuentry></menu>

</top>
<node>
<nodename>chapter</nodename>
<nodeprev>Top</nodeprev>
<nodeup>Top</nodeup>
</node>
<chapter>
<title>chapter</title>

<para>In chapter
</para>
</chapter>
</texinfo>
