<?xml version="1.0"?>
<!DOCTYPE texinfo PUBLIC "-//GNU//DTD TexinfoML V4.12//EN" "http://www.gnu.org/software/texinfo/dtd/4.12/texinfo.dtd">
<texinfo xml:lang="en">

<setfilename>node-whitespace.xml</setfilename>

<!-- Makeinfo should collapse whitespace in node names. -->


<node>
<nodename>Top</nodename>
<nodenext>Chap 1.3</nodenext>
<nodeup>(dir)</nodeup>
</node>
<top>
<title>Whitespace in Node Names</title>


<menu>
<menuentry>
<menunode>Chap 1.3</menunode>
<menutitle>Chap  1.3  </menutitle>
<menucomment>
</menucomment>
</menuentry><menuentry>
<menunode>Chap 1.4</menunode>
<menutitle> Chap  1.4  </menutitle>
<menucomment>
</menucomment>
</menuentry></menu>

</top>
<node>
<nodename>Chap 1.3</nodename>
<nodenext>Chap 1.4</nodenext>
<nodeprev>Top</nodeprev>
<nodeup>Top</nodeup>
</node>
<chapter>
<title>Chap 1.3</title>

<para>Can I reach here?
</para>
</chapter>
<node>
<nodename>Chap 1.4</nodename>
<nodeprev>Chap 1.3</nodeprev>
<nodeup>Top</nodeup>
</node>
<chapter>
<title>Another space test</title>

<para>How about here?
See <xref><xrefnodename>Chap 1.3</xrefnodename></xref>.
</para>
</chapter>
</texinfo>
