<?xml version="1.0"?>
<!DOCTYPE texinfo PUBLIC "-//GNU//DTD TexinfoML V4.12//EN" "http://www.gnu.org/software/texinfo/dtd/4.12/texinfo.dtd">
<texinfo xml:lang="en">

<setfilename>top_without_node.xml</setfilename>

<para>Garbage
</para>
<node>
<nodename>a node</nodename>
<nodeup>(dir)</nodeup>
</node>
<unnumbered>
<title>unnumbered</title>

<para>in unnumbered
</para>
</unnumbered>
<unnumbered>
<title>top section</title>
<para>Top section
</para>
<titlefont>The top section, no top node</titlefont>

<node>
<nodename>second</nodename>
<nodeup>(dir)</nodeup>
</node>
<section>
<title>second</title>

<para>second node
</para>
</section>
</unnumbered>
<chapter>
<title>Chapter</title>

<para>Text of chapter
</para>
</chapter>
<chapter>
<title>Chapter 2</title>


<para>Text of chapter 2
</para>
</chapter>
</texinfo>
<!-- Keep this comment at the end of the file
Local variables:
mode: sgml
sgml-indent-step:1
sgml-indent-data:nil
End:
-->
