<?xml version="1.0"?>
<!DOCTYPE texinfo PUBLIC "-//GNU//DTD TexinfoML V4.12//EN" "http://www.gnu.org/software/texinfo/dtd/4.12/texinfo.dtd">
<texinfo xml:lang="en">

<setfilename>section_before_top.xml</setfilename>

<node>
<nodename>section node</nodename>
<nodeprev>Top</nodeprev>
<nodeup>Top</nodeup>
</node>
<section>
<title>section</title>

</section>
<node>
<nodename>Top</nodename>
<nodenext>section node</nodenext>
<nodeprev>section node</nodeprev>
<nodeup>(dir)</nodeup>
</node>
<top>
<title>top</title>

<menu>
<menuentry>
<menunode>section node</menunode>
<menutitle>section node</menutitle>
<menucomment>
</menucomment>
</menuentry></menu>

</top>
</texinfo>
