<?xml version="1.0"?>
<!DOCTYPE texinfo PUBLIC "-//GNU//DTD TexinfoML V4.12//EN" "http://www.gnu.org/software/texinfo/dtd/4.12/texinfo.dtd">
<texinfo xml:lang="en">

<setfilename>nodes_before_top.xml</setfilename>

<node>
<nodename>first</nodename>
<nodenext>Top</nodenext>
<nodeup>(dir)</nodeup>

<para>in first node
</para><menu>
<menuentry>
<menunode> node in menu before top</menunode>
<menutitle> node in menu before top</menutitle>
<menucomment>
</menucomment>
</menuentry></menu>

<titlefont>A titlefont in a node</titlefont>

</node>
<node>
<nodename>node in menu before top</nodename>
<nodeup>first</nodeup>

<para>node in menu before top text
</para>
</node>
<node>
<nodename>Top</nodename>
<nodeprev>first</nodeprev>
<unnumbered>
<title>top section</title>
<para>Top node
</para><menu>
<menuentry>
<menunode> second node</menunode>
<menutitle> second node</menutitle>
<menucomment>
</menucomment>
</menuentry></menu>

</unnumbered>
</node>
<node>
<nodename>second node</nodename>
<nodeup>Top</nodeup>
<chapter>
<title>a chapter</title>

<para>second node
</para>


</chapter>
</node>
</texinfo>
<!-- Keep this comment at the end of the file
Local variables:
mode: sgml
sgml-indent-step:1
sgml-indent-data:nil
End:
-->
