<?xml version="1.0"?>
<!DOCTYPE texinfo PUBLIC "-//GNU//DTD TexinfoML V4.12//EN" "http://www.gnu.org/software/texinfo/dtd/4.12/texinfo.dtd">
<texinfo xml:lang="en">

<setfilename>test_two_include.xml</setfilename>

<node>
<nodename>Top</nodename>
<nodeup>(dir)</nodeup>
</node>

<para>Include version
<setvalue name="UPDATED">28 March 2002</setvalue>
<setvalue name="UPDATED-MONTH">March 2002</setvalue>
<setvalue name="EDITION">4.2</setvalue>
<setvalue name="VERSION">4.2</setvalue>
</para>
<para>include inc_file
In included file.
</para>
<para>After inclusion.
</para>
</texinfo>
<!-- Keep this comment at the end of the file
Local variables:
mode: sgml
sgml-indent-step:1
sgml-indent-data:nil
End:
-->
