<?xml version="1.0"?>
<!DOCTYPE texinfo PUBLIC "-//GNU//DTD TexinfoML V4.12//EN" "http://www.gnu.org/software/texinfo/dtd/4.12/texinfo.dtd">
<texinfo xml:lang="en">

<setfilename>two_footnotes_in_nodes.xml</setfilename>

<node>
<nodename>Top</nodename>
<nodenext>chapter</nodenext>
<nodeup>(dir)</nodeup>
</node>
<unnumbered>
<title>2 footnotes in 2 nodes</title>

<para>A<footnote><para>Footnote Top/1
</para>
<para>para2
</para></footnote>
</para>
<para>B<footnote><para>Footnote Top/2
</para>
<para>para2
</para></footnote>
</para>
<menu>
<menuentry>
<menunode>chapter</menunode>
<menutitle>chapter</menutitle>
<menucomment>
</menucomment>
</menuentry></menu>

</unnumbered>
<node>
<nodename>chapter</nodename>
<nodeprev>Top</nodeprev>
<nodeup>Top</nodeup>
</node>
<chapter>
<title>chapter</title>

<para>C<footnote><para>Footnote chapter/1
</para>
<para>para2
</para></footnote>
</para>
<para>D<footnote><para>Footnote chapter/2
</para>
<para>para2
</para></footnote>
</para>
</chapter>
</texinfo>
<!-- Keep this comment at the end of the file
Local variables:
mode: sgml
sgml-indent-step:1
sgml-indent-data:nil
End:
-->
