<?xml version="1.0"?>
<!DOCTYPE texinfo PUBLIC "-//GNU//DTD TexinfoML V4.12//EN" "http://www.gnu.org/software/texinfo/dtd/4.12/texinfo.dtd">
<texinfo xml:lang="en">
<setfilename>lower_subsub.xml</setfilename>
<node>
<nodename>Top</nodename>
<nodenext>Chapter</nodenext>
<nodeup>(dir)</nodeup>
</node>
<unnumbered>
<title></title>

<menu>
<menuentry>
<menunode>Chapter</menunode>
<menutitle>Chapter</menutitle>
<menucomment>
</menucomment>
</menuentry></menu>

</unnumbered>
<node>
<nodename>Chapter</nodename>
<nodeprev>Top</nodeprev>
<nodeup>Top</nodeup>
</node>
<chapter>
<title>Chapter</title>

<menu>
<menuentry>
<menunode>Section</menunode>
<menutitle>Section</menutitle>
<menucomment>
</menucomment>
</menuentry></menu>

<node>
<nodename>Section</nodename>
<nodeup>Chapter</nodeup>
</node>
<section>
<title>Section</title>

<menu>
<menuentry>
<menunode>Subsection</menunode>
<menutitle>Subsection</menutitle>
<menucomment>
</menucomment>
</menuentry></menu>

<node>
<nodename>Subsection</nodename>
<nodeup>Section</nodeup>
</node>
<subsection>
<title>Subsection</title>

<menu>
<menuentry>
<menunode>Subsubsection</menunode>
<menutitle>Subsubsection</menutitle>
<menucomment>
</menucomment>
</menuentry><menuentry>
<menunode>Lowered subsec</menunode>
<menutitle>Lowered subsec</menutitle>
<menucomment>
</menucomment>
</menuentry></menu>

<node>
<nodename>Subsubsection</nodename>
<nodenext>Lowered subsec</nodenext>
<nodeup>Subsection</nodeup>
</node>
<subsubsection>
<title>Subsubsection</title>

<lowersections></lowersections></subsubsection>
<node>
<nodename>Lowered subsec</nodename>
<nodenext>Lowered subsubsection</nodenext>
<nodeprev>Subsubsection</nodeprev>
<nodeup>Subsection</nodeup>
</node>
<subsubsection>
<title>Lowered subsec</title>

<menu>
<menuentry>
<menunode>Lowered subsubsection</menunode>
<menutitle>Lowered subsubsection</menutitle>
<menucomment>
</menucomment>
</menuentry></menu>

</subsubsection>
<node>
<nodename>Lowered subsubsection</nodename>
<nodeprev>Lowered subsec</nodeprev>
<nodeup>Subsection</nodeup>
</node>
<subsubsection>
<title>Lowered subsubsection</title>
<raisesections></raisesections>
<contents></contents>
</subsubsection>
</subsection>
</section>
</chapter>
</texinfo>
<!-- Keep this comment at the end of the file
Local variables:
mode: sgml
sgml-indent-step:1
sgml-indent-data:nil
End:
-->
