<?xml version="1.0"?>
<!DOCTYPE texinfo PUBLIC "-//GNU//DTD TexinfoML V4.12//EN" "http://www.gnu.org/software/texinfo/dtd/4.12/texinfo.dtd">
<texinfo xml:lang="en">
<setfilename>nodename_parentheses.xml</setfilename>
<node>
<nodename>Top</nodename>
<nodenext>Node (with parentheses)</nodenext>
<nodeup>(dir)</nodeup>
</node>
<top>
<title>The top node</title>

<menu>
<menuentry>
<menunode>Node (with parentheses)</menunode>
<menutitle>Node (with parentheses)</menutitle>
<menucomment>
</menucomment>
</menuentry><menuentry>
<menunode>Other node</menunode>
<menutitle>Other node</menutitle>
<menucomment>
</menucomment>
</menuentry><menuentry>
<menunode>(manual)node</menunode>
<menutitle>(manual)node</menutitle>
<menucomment>
</menucomment>
</menuentry></menu>

</top>
<node>
<nodename>Node (with parentheses)</nodename>
<nodenext>Other node</nodenext>
<nodeprev>Top</nodeprev>
<nodeup>Top</nodeup>
</node>
<chapter>
<title>Section (nodename with parentheses)</title>

<para>Dummy section
</para>
</chapter>
<node>
<nodename>Other node</nodename>
<nodeprev>Node (with parentheses)</nodeprev>
<nodeup>Top</nodeup>
</node>
<chapter>
<title>Section (nodename without parentheses)</title>

<para>Dummy link to <xref><xrefnodename>Node (with parentheses)</xrefnodename></xref>.
</para>
<para>Dummy link to <xref><xrefnodename>(manual)node</xrefnodename></xref>.
</para>
</chapter>
<chapter>
<title>(manual)node</title>

<para>Dummy section with (manual)node node syntax.
</para>
<contents></contents>
</chapter>
</texinfo>
<!-- Keep this comment at the end of the file
Local variables:
mode: sgml
sgml-indent-step:1
sgml-indent-data:nil
End:
-->
