<?xml version="1.0"?>
<!DOCTYPE texinfo PUBLIC "-//GNU//DTD TexinfoML V4.12//EN" "http://www.gnu.org/software/texinfo/dtd/4.12/texinfo.dtd">
<texinfo xml:lang="en">

<setfilename>top.xml</setfilename>
<settitle>top test</settitle>

<!-- This traditional top node uses @ifinfo for testing. -->
<!-- Therefore there will be warnings when processing with -html. -->
<!-- The solution is to use @ifnottex instead. -->


<menu>
<menuentry>
<menunode> Subnode</menunode>
<menutitle> Subnode</menutitle>
<menucomment>
</menucomment>
</menuentry></menu>

<node>
<nodename>Subnode</nodename>
<chapter>
<title>Subnode</title>

<para>Subnode.
</para>
</chapter>
</node>
</texinfo>
<!-- Keep this comment at the end of the file
Local variables:
mode: sgml
sgml-indent-step:1
sgml-indent-data:nil
End:
-->
