<?xml version="1.0"?>
<!DOCTYPE texinfo PUBLIC "-//GNU//DTD TexinfoML V4.12//EN" "http://www.gnu.org/software/texinfo/dtd/4.12/texinfo.dtd">
<texinfo xml:lang="en">

<setfilename>nodes_after_top.xml</setfilename>


<node>
<nodename>Top</nodename>
<nodenext>second node</nodenext>
<nodeup>(dir)</nodeup>
<para>Top node
</para><menu>
<menuentry>
<menunode> second node</menunode>
<menutitle> second node</menutitle>
<menucomment>
</menucomment>
</menuentry><menuentry>
<menunode> third node</menunode>
<menutitle> third node</menutitle>
<menucomment>
</menucomment>
</menuentry></menu>

</node>
<node>
<nodename>second node</nodename>
<nodenext>third node</nodenext>
<nodeprev>Top</nodeprev>
<nodeup>Top</nodeup>

<para>second node
</para>
</node>
<node>
<nodename>third node</nodename>
<nodeprev>second node</nodeprev>
<nodeup>Top</nodeup>


</node>
</texinfo>
<!-- Keep this comment at the end of the file
Local variables:
mode: sgml
sgml-indent-step:1
sgml-indent-data:nil
End:
-->
