<?xml version="1.0"?>
<!DOCTYPE texinfo PUBLIC "-//GNU//DTD TexinfoML V4.12//EN" "http://www.gnu.org/software/texinfo/dtd/4.12/texinfo.dtd">
<texinfo xml:lang="en">

<setfilename>part_chapter_after_top.xml</setfilename>

<node>
<nodename>Top</nodename>
<nodenext>chapter</nodenext>
<nodeup>(dir)</nodeup>
</node>
<top>
<title>top</title>

<menu>
<menuentry>
<menunode>chapter</menunode>
<menutitle>chapter</menutitle>
<menucomment>
</menucomment>
</menuentry></menu>

</top>
<part>
<title>part</title>

<node>
<nodename>chapter</nodename>
<nodeprev>Top</nodeprev>
<nodeup>Top</nodeup>
</node>
<chapter>
<title>chapter</title>

</chapter>
</part>
</texinfo>
