<?xml version="1.0"?>
<!DOCTYPE texinfo PUBLIC "-//GNU//DTD TexinfoML V4.12//EN" "http://www.gnu.org/software/texinfo/dtd/4.12/texinfo.dtd">
<texinfo xml:lang="en">

<setfilename>test_refs.xml</setfilename>
<node>
<nodename>Top</nodename>
<nodenext>other nodes</nodenext>
<nodeup>(dir)</nodeup>
</node>
<top>
<title>Test refs</title>

<menu>
<menuentry>
<menunode>other nodes</menunode>
<menutitle>other nodes</menutitle>
<menucomment>
</menucomment>
</menuentry></menu>

<subheading>Testing distant nodes</subheading>

<para> a  node  <xref><xrefnodename>a node</xrefnodename><xrefinfofile>manual</xrefinfofile></xref>&linebreak;
</para><example xml:space="preserve">mono : manual.html#a-node
split: ../manual/a-node.html#a-node
</example>
<para>: <xref><xrefnodename>:</xrefnodename><xrefinfofile>manual</xrefinfofile></xref>
</para><example xml:space="preserve">mono : manual.html#_003a
split: ../manual/_003a.html#_003a
</example>
<para>Top <xref><xrefnodename>top</xrefnodename><xrefinfofile>manual</xrefinfofile></xref>&linebreak; 
</para><example xml:space="preserve">mono : manual.html#Top
split: ../manual/index.html#Top
</example>
<para>(texinfo)Cross References <xref><xrefnodename>(texinfo)Cross References</xrefnodename></xref>
</para><example xml:space="preserve">mono: texinfo.html#Cross-References
split: ../texinfo/Cross-References.html#Cross-References
</example>
<subheading>Testing manual name</subheading>

<para>../manual/doc.texi <xref><xrefnodename>node</xrefnodename><xrefinfofile>../manual/doc.texi</xrefinfofile></xref>&linebreak;
</para><example xml:space="preserve">mono : doc.html#node
split: ../doc/node.html#node
</example>
<subheading>Testing local nodes</subheading>

<para>!_&quot;#$%&amp;'()*+-./;&lt;=&gt;?[\]^_`|~ <xref><xrefnodename>!_&quot;#$%&amp;'()*+-./;&lt;=&gt;?[\]^_`|~</xrefnodename></xref>&linebreak;
</para><example xml:space="preserve">target: #_0021_005f_0022_0023_0024_0025_0026_0027_0028_0029_002a_002b_002d_002e_002f_003b_003c_003d_003e_003f_005b_005c_005d_005e_005f_0060_007c_007e
</example>
<para>Top <xref><xrefnodename>Top</xrefnodename></xref>
</para><example xml:space="preserve">target: #Top
</example>
<para> local   node <xref><xrefnodename>local node</xrefnodename></xref>
</para><example xml:space="preserve">target: #local-node
</example>
</top>
<node>
<nodename>other nodes</nodename>
<nodenext>!_&quot;#$%&amp;'()*+-./;&lt;=&gt;?[\]^_`|~</nodenext>
<nodeprev>Top</nodeprev>
<nodeup>Top</nodeup>
</node>
<chapter>
<title>Chapter with nodes</title>

<example xml:space="preserve">id: other-nodes
</example>
<para>Top <xref><xrefnodename>Top</xrefnodename></xref>
</para><example xml:space="preserve">target: #Top
</example>
<menu>
<menuentry>
<menunode>!_&quot;#$%&amp;'()*+-./;&lt;=&gt;?[\]^_`|~</menunode>
<menutitle>!_&quot;#$%&amp;'()*+-./;&lt;=&gt;?[\]^_`|~</menutitle>
<menucomment>
</menucomment>
</menuentry><menuentry>
<menunode>local node</menunode>
<menutitle>local node</menutitle>
<menucomment>
</menucomment>
</menuentry></menu>

</chapter>
<node>
<nodename>!_&quot;#$%&amp;'()*+-./;&lt;=&gt;?[\]^_`|~</nodename>
<nodenext>local node</nodenext>
<nodeprev>other nodes</nodeprev>
<nodeup>other nodes</nodeup>
</node>
<example xml:space="preserve">id: _0021_005f_0022_0023_0024_0025_0026_0027_0028_0029_002a_002b_002d_002e_002f_003b_003c_003d_003e_003f_005b_005c_005d_005e_005f_0060_007c_007e
</example>
<node>
<nodename>local node</nodename>
<nodeprev>!_&quot;#$%&amp;'()*+-./;&lt;=&gt;?[\]^_`|~</nodeprev>
<nodeup>other nodes</nodeup>
</node>
<example xml:space="preserve">id: local-node
</example>
</texinfo>
