<?xml version="1.0"?>
<!DOCTYPE texinfo PUBLIC "-//GNU//DTD TexinfoML V4.12//EN" "http://www.gnu.org/software/texinfo/dtd/4.12/texinfo.dtd">
<texinfo xml:lang="en">

<setfilename>rec_nodes.xml</setfilename>


<node>
<nodename>Top</nodename>
<nodenext>second node</nodenext>
<nodeup>(dir)</nodeup>
</node>
<para>Top node
</para>
<menu>
<menuentry>
<menunode>second node</menunode>
<menutitle>second node</menutitle>
<menucomment>
</menucomment>
</menuentry><menuentry>
<menunode>node following second</menunode>
<menutitle>node following second</menutitle>
<menucomment>
</menucomment>
</menuentry></menu>

<node>
<nodename>second node</nodename>
<nodeprev>Top</nodeprev>
<nodeup>Top</nodeup>
</node>
<para>second node (@node second node,,top,TOP).
<!-- anchor TOP: @anchor{TOP}. -->
</para>
<menu>
<menuentry>
<menunode>other node</menunode>
<menutitle>other node</menutitle>
<menucomment>
</menucomment>
</menuentry><menuentry>
<menunode>second node</menunode>
<menutitle>second node</menutitle>
<menucomment>
</menucomment>
</menuentry></menu>

<node>
<nodename>other node</nodename>
<nodeup>second node</nodeup>
</node>
<!-- anchor top @anchor{top}. -->
<!-- ref to TOP @ref{TOP}. -->

<menu>
<menuentry>
<menunode>other node</menunode>
<menutitle>other node</menutitle>
<menucomment>
</menucomment>
</menuentry></menu>

<node>
<nodename>node up node following second</nodename>
<nodeup>node following second</nodeup>
</node>
<menu>
<menuentry>
<menunode>node following second</menunode>
<menutitle>node following second</menutitle>
<menucomment>
</menucomment>
</menuentry></menu>

<para>in node up node following second
</para>
<node>
<nodename>node following second</nodename>
<nodeup>node up node following second</nodeup>
</node>

<para>in node following second
</para><menu>
<menuentry>
<menunode>node up node following second</menunode>
<menutitle>node up node following second</menutitle>
<menucomment>
</menucomment>
</menuentry></menu>

</texinfo>
<!-- Keep this comment at the end of the file
Local variables:
mode: sgml
sgml-indent-step:1
sgml-indent-data:nil
End:
-->
