<?xml version="1.0"?>
<!DOCTYPE texinfo PUBLIC "-//GNU//DTD TexinfoML V4.12//EN" "http://www.gnu.org/software/texinfo/dtd/4.12/texinfo.dtd">
<texinfo xml:lang="en">

<setfilename>semi_auto.xml</setfilename>

<node>
<nodename>Top</nodename>
<nodenext>Chap1</nodenext>
<nodeup>(dir)</nodeup>
</node>
<unnumbered>
<title>Top</title>

<menu>
<menuentry>
<menunode>Chap1</menunode>
<menutitle>Chap1</menutitle>
<menucomment>
</menucomment>
</menuentry><menuentry>
<menunode>Section non auto</menunode>
<menutitle>Section non auto</menutitle>
<menucomment>
</menucomment>
</menuentry></menu>

</unnumbered>
<node>
<nodename>Chap1</nodename>
<nodeprev>Top</nodeprev>
<nodeup>Top</nodeup>
</node>
<chapter>
<title>Chapter 1</title>

<menu>
<menuentry>
<menunode>Sec in chapter</menunode>
<menutitle>Sec in chapter</menutitle>
<menucomment>
</menucomment>
</menuentry></menu>

<node>
<nodename>Sec in chapter</nodename>
<nodenext>Section non auto</nodenext>
<nodeup>Chap1</nodeup>
</node>
<section>
<title>Sec in chapter</title>

</section>
<node>
<nodename>Section non auto</nodename>
<nodeprev>Chap1</nodeprev>
<nodeup>Top</nodeup>
</node>
<section>
<title>Section</title>

</section>
</chapter>
</texinfo>
<!-- Keep this comment at the end of the file
Local variables:
mode: sgml
sgml-indent-step:1
sgml-indent-data:nil
End:
-->
