<?xml version="1.0"?>
<!DOCTYPE texinfo PUBLIC "-//GNU//DTD TexinfoML V4.12//EN" "http://www.gnu.org/software/texinfo/dtd/4.12/texinfo.dtd">
<texinfo xml:lang="en">

<setfilename>before_node_and_section.xml</setfilename>

<para>Garbage
ref to Top <xref><xrefnodename>Top</xrefnodename></xref>.
<indexterm index="cp">index entry before anything</indexterm>Hey<footnote><para>a footnote
</para></footnote>.
An anchor <anchor name="anchor1"></anchor>.
</para>
<menu>
<menuentry>
<menunode>node1</menunode>
<menutitle>node1</menutitle>
<menucomment>
</menucomment>
</menuentry></menu>

<node>
<nodename>Top</nodename>
<nodenext>node1</nodenext>
<nodeup>(dir)</nodeup>
</node>
<unnumbered>
<title>top @top section</title>
<para>Node top
</para>
<para>ref to anchor1<footnote><para>another footnote
</para></footnote>, which is before @node Top: <xref><xrefnodename>anchor1</xrefnodename></xref>.
</para><menu>
<menuentry>
<menunode>node1</menunode>
<menutitle>node1</menutitle>
<menucomment>
</menucomment>
</menuentry></menu>

</unnumbered>
<node>
<nodename>node1</nodename>
<nodeprev>Top</nodeprev>
<nodeup>Top</nodeup>
</node>
<chapter>
<title>node1 chapter</title>

<printindex>cp</printindex>

</chapter>
</texinfo>
<!-- Keep this comment at the end of the file
Local variables:
mode: sgml
sgml-indent-step:1
sgml-indent-data:nil
End:
-->
