<?xml version="1.0"?>
<!DOCTYPE texinfo PUBLIC "-//GNU//DTD TexinfoML V4.12//EN" "http://www.gnu.org/software/texinfo/dtd/4.12/texinfo.dtd">
<texinfo xml:lang="en">

<setfilename>one_section.xml</setfilename>

<para>Garbage
</para>
<subsection>
<title>The subsection</title>

<para>anchor ref <anchor name="ref"></anchor>.
</para>
<menu>
<menuentry>
<menunode>(gcc)</menunode>
<menutitle>(gcc)</menutitle>
<menucomment> ref to gcc
</menucomment>
</menuentry></menu>


<para>ref to ref <xref><xrefnodename>ref</xrefnodename></xref>.
</para>
<para>Some text.
</para>
</subsection>
</texinfo>
<!-- Keep this comment at the end of the file
Local variables:
mode: sgml
sgml-indent-step:1
sgml-indent-data:nil
End:
-->
