<?xml version="1.0"?>
<!DOCTYPE texinfo PUBLIC "-//GNU//DTD TexinfoML V4.12//EN" "http://www.gnu.org/software/texinfo/dtd/4.12/texinfo.dtd">
<texinfo xml:lang="en">

<setfilename>section_chapter_before_top.xml</setfilename>

<section>
<title>section</title>

</section>
<chapter>
<title>chapter</title>

</chapter>
<top>
<title>top</title>

</top>
</texinfo>
